{
  "$schema": "./schema.json",
  "name": "telekids",
  "displayName": "Telekids",
  "category": "entertainment",
  "description": "Telekids Dutch children's TV spinner verbs",
  "author": "JJ",
  "github": "doublej",
  "language": "nl_NL",
  "config": {
    "showTurnDuration": false,
    "spinnerVerbs": {
      "mode": "replace",
      "verbs": [
        "De telefoon naar een kijker bellen",
        "Carlo volledig overdrijven imiteren",
        "Irene's beroemde lach kopiÃ«ren",
        "Gekke stemmen voor sketches gebruiken",
        "Het studio-orkest gek maken",
        "Rare pruiken uit de kast halen",
        "Toeschouwers via telefoon vragen stellen",
        "Liedjes van het moment improviseren",
        "Wilde dansen voor camera uitvoeren",
        "Telefonisten met grappen om zeep helpen",
        "Improvisatie-sketches van niks bedenken",
        "Absurde grappen uithalen in studio",
        "Totale studio-chaos veroorzaken",
        "Belachelijke gezichten naar camera trekken",
        "De klok opzettelijk verkeerd zeggen",
        "Mime-spelletjes zonder woorden spelen",
        "Live sketches uit je hoofd opvoeren",
        "Gekke liedjes met rare rhymes zingen",
        "Vreemde wedstrijdjes ter plekke spelen",
        "Flamboyante kostuums aantrekken",
        "Huisnummers van kijkers verzamelen",
        "Dieren grappig en schril uitbeelden",
        "De studio op stelten zetten",
        "Hallucinante aankondigingen live doen",
        "Alles improviseren zonder script",
        "Gekke toneelstukken in scenes spelen",
        "Medekandidaten tegen de gastheer opzetten",
        "Bizarre videofragmenten introduceren",
        "Komische kindersspelletjes verzinnen",
        "De cameraman volledig misleiden",
        "Onwaarschijnlijke verhalen vertellen",
        "Grappige acrobatische stunts doen",
        "Gekke toneelwerk op het moment spelen",
        "Het orkest aan het lachen krijgen",
        "Vreemde quizvragen van jezelf bedenken",
        "Tape-trucjes en video-gags gebruiken",
        "De camera bedriegen met bewegingen",
        "Woordspellingen en grapjes maken",
        "Dansen met volledig gekke bewegingen",
        "Telefoongesprekken live naspelen",
        "Gekke prijzen absurd uitreiken",
        "Moppen en grappen af vuren",
        "De hele studio helemaal rocken",
        "Grappige tapdans-nummers opvoeren",
        "Het publiek samen tegen gastheer zetten",
        "Rare gasten ontvangen en plagen",
        "Gekke studio-animatie bedrijven",
        "Vreemde mededelingen oraal maken",
        "Live band in gekke jams laten jammen",
        "De studio compleet op zijn kop zetten"
      ]
    }
  }
}
