{
  "$schema": "./schema.json",
  "name": "us-the-office",
  "displayName": "The Office",
  "category": "entertainment",
  "description": "The Office (US) spinner verbs â€” Dunder Mifflin style",
  "author": "JJ",
  "github": "doublej",
  "language": "en_US",
  "config": {
    "spinnerVerbs": {
      "mode": "replace",
      "verbs": [
        "Declaring bankruptcy loudly",
        "Scheduling another meeting about meetings",
        "Putting stuff in Jell-O",
        "Staring at the camera meaningfully",
        "Microwaving fish in the breakroom",
        "Forming an alliance temporarily",
        "Running a paper company somehow",
        "Pulling a prank on Dwight",
        "Checking if it's pretzel day",
        "Avoiding Toby at all costs",
        "Hosting an impromptu dundies ceremony",
        "Investigating the Scranton Strangler",
        "Performing CPR on a dummy",
        "Waiting for someone to notice",
        "Explaining the rules of parkour",
        "Counting down to five o'clock",
        "Ignoring corporate's latest memo",
        "Playing desert island scenarios",
        "Sabotaging the vending machine",
        "Hiding from a conference call",
        "Requesting a transfer quietly",
        "Filing a complaint with HR",
        "Rehearsing a dramatic entrance",
        "Alphabetizing the supply closet",
        "Proposing a new theme song",
        "Defending my World's Best mug",
        "Organising an office Olympics",
        "Pitching an unnecessary birthday party",
        "Raiding the vending machine funds",
        "Making chili for the potluck",
        "Setting the thermostat war ablaze",
        "Confiscating Dwight's nunchucks again",
        "Googling management techniques frantically",
        "Questioning my career trajectory",
        "Rehearsing a motivational speech",
        "Untangling a love triangle situation",
        "Crafting the perfect that's what she said",
        "Navigating the warehouse staircase",
        "Photocopying something very important",
        "Reorganising the seating chart again",
        "Scheduling a team-building retreat",
        "Polishing my Dundie trophy",
        "Drafting an office-wide announcement",
        "Recapping last night's TV episode",
        "Debating whether to join the party planning committee",
        "Sneaking snacks from accounting",
        "Pretending to work very hard",
        "Updating the suggestion box status",
        "Celebrating a minor sales victory",
        "Contemplating the meaning of work"
      ]
    }
  }
}
