{
  "$schema": "./schema.json",
  "name": "uk-peep-show",
  "displayName": "Peep Show",
  "category": "entertainment",
  "description": "Peep Show inner monologue spinner verbs",
  "author": "JJ",
  "github": "doublej",
  "language": "en_GB",
  "config": {
    "showTurnDuration": false,
    "spinnerVerbs": {
      "mode": "replace",
      "verbs": [
        "I rehearse a casual hello",
        "I avoid Big Suze's gaze",
        "I endure Jeremy's latest scheme",
        "I contemplate my mortality again",
        "I regret inviting Super Hans",
        "I imagine Mark understanding me",
        "I practice my turkey lie",
        "I obsess over tiny details",
        "I experience overwhelming social dread",
        "I tolerate Rainbow Rhythms yet again",
        "I recoil from Elena's advances",
        "I pretend I'm not home",
        "I analyze my romantic failings",
        "I watch Jeremy destroy everything",
        "I question why I'm here",
        "I endure Jeremy's band nonsense",
        "I contemplate the Orgazoid debate",
        "I avoid Johnson's disappointed stare",
        "I explain myself poorly to Sophie",
        "I calculate the turkey weight",
        "I dread the wedding reception",
        "I tolerate Dobby's presence somehow",
        "I rationalize my poor choices",
        "I observe Mark's internal spiraling",
        "I suffer through another awkward meal",
        "I imagine my better life",
        "I regret the Quantocking trip entirely",
        "I process Mark's passive aggression",
        "I forget why we're friends",
        "I panic about four naan again",
        "I withstand another Jeremy monologue",
        "I contemplate Big Suze's judgment",
        "I navigate Mark's constant criticism",
        "I wonder about Super Hans's past",
        "I endure the flat's growing chaos",
        "I second-guess every interaction badly",
        "I battle my own inadequacy",
        "I witness Jeremy's delusional confidence",
        "I absorb Mark's neurotic energy",
        "I cringe at my recent statement",
        "I justify my questionable behavior",
        "I confront uncomfortable truths badly",
        "I experience dread before meetings",
        "I underestimate Jeremy's stupidity again",
        "I overanalyze Mark's cryptic comments",
        "I suffer through another Suez discussion",
        "I accommodate Super Hans's requests",
        "I regret speaking to Sophie",
        "I contemplate my wasted potential",
        "I endure another day somehow"
      ]
    }
  }
}
