{
  "$schema": "./schema.json",
  "name": "ca-letterkenny",
  "displayName": "Letterkenny",
  "category": "entertainment",
  "description": "Letterkenny rural Ontario spinner verbs",
  "author": "JJ",
  "github": "doublej",
  "language": "en_CA",
  "config": {
    "showTurnDuration": false,
    "spinnerVerbs": {
      "mode": "replace",
      "verbs": [
        "I pitter patter let's get at 'er",
        "I figure it out like a true hick",
        "I go to the produce stand real quick",
        "I have a dart and contemplate life",
        "I get after it hard every single day",
        "I stay for a beer after hockey practice",
        "I appreciate the simple rural Ontario things",
        "I give it to you straight no cap",
        "I allegedly do the wildest things",
        "I chore real hard around the property",
        "I catch a buzz down by the bonfire",
        "I talk to myself in the deli line",
        "I roast the boys with surgical precision",
        "I dial it back when things get spicy",
        "I get absolutely fucked up boys",
        "I keep it real like Wayne would",
        "I know what's up with the hockey scene",
        "I call out the bullshit every time",
        "I work the land like it's my calling",
        "I spit bars at the meanest rate",
        "I contemplate the cold Ontario nights",
        "I give respect where respect is due",
        "I get down to brass tacks quick",
        "I crush it at everything that I do",
        "I settle it all with a hockey fight",
        "I go hard in the paint son",
        "I keep my wits sharp and ready",
        "I roll with the country boys daily",
        "I say it like it really truly is",
        "I know the way things work up here",
        "I handle my business with pure grit",
        "I stay true to the rural code",
        "I get nasty down at the rink",
        "I appreciate that so fucking much",
        "I read the room and adjust my tone",
        "I ask you to settle down there",
        "I grab a beer and relax buddy",
        "I tell it straight from the hip",
        "I make it work with what we got",
        "I keep it tight like a drum",
        "I give you my honest assessment here",
        "I go until my knees are sore",
        "I keep the tradition alive real strong",
        "I stay in my lane down the road",
        "I nail the delivery every single time",
        "I know exactly what you're about",
        "I make the community really fucking proud",
        "I speak the dialect of my forebears",
        "I handle disputes with maturity always",
        "I represent the rural Ontario way"
      ]
    }
  }
}
