{
  "$schema": "./schema.json",
  "name": "jiskefet",
  "displayName": "Jiskefet",
  "category": "entertainment",
  "description": "Jiskefet-themed Dutch spinner verbs",
  "author": "doublej",
  "github": "doublej",
  "language": "nl_NL",
  "config": {
    "showTurnDuration": false,
    "spinnerVerbs": {
      "mode": "replace",
      "verbs": [
        "Petor roepen",
        "Peter roepen",
        "De knik in het geluid melden",
        "Naar B wegmoduleren",
        "Een elleboog op tafel zetten",
        "Een jack-in-the-box doen",
        "Ham & eggs bestellen",
        "Freddy een koffie aanbieden",
        "Een tropical drink bestellen",
        "Goedemorgen deze morgen zeggen",
        "Goeiesmorgens zeggen",
        "Over de tramhalte beginnen",
        "Bij ons op de commando's herinneren",
        "Vragen wat jij d'r op hebt",
        "Uit stilstand vertrekken",
        "Toedeledoki zeggen",
        "Sjesis roepen",
        "Goeiemiddag zeggen",
        "Roeptoeteren: heel geen vogel",
        "Volhouden: w√©l degelijk een vogel",
        "Alles waar 'te' voor staat opsommen",
        "Tequila uitzonderen",
        "Natte benen krijgen",
        "Stiften pakken",
        "Zalf smeren",
        "Haar uit m'n glas halen",
        "Scheepskamelen noemen",
        "Naar het inbouwcentrum gaan",
        "Een Wiedergutmachungsschnitzel bestellen",
        "Over der Jugend beginnen",
        "De Debiteansen nadoen",
        "Een schnitzel op het hoofd leggen",
        "Met een koffer binnenkomen",
        "Oost-Indisch doof zijn",
        "Een Duits accent opzetten",
        "De commandos inspecteren",
        "Freddy een broodje aanbieden",
        "Naar de tramhalte wijzen",
        "Over het weer beginnen",
        "Een knik in het geluid zoeken",
        "Het vinkentouw pakken",
        "Mevrouw Pansen bellen",
        "Een glas thee inschenken",
        "Naar de sportschool liegen",
        "De was ophangen",
        "Een potje koffie zetten",
        "Meneer de Ansen groeten",
        "De notulen voorlezen",
        "Klagen over de verwarming",
        "De telefoon voor Petor aannemen"
      ]
    }
  }
}
