{
  "$schema": "./schema.json",
  "name": "us-billie-eilish",
  "displayName": "Billie Eilish",
  "category": "music",
  "description": "Billie Eilish-inspired moody spinner verbs",
  "author": "JJ",
  "github": "doublej",
  "language": "en_US",
  "config": {
    "showTurnDuration": false,
    "spinnerVerbs": {
      "mode": "replace",
      "verbs": [
        "I whisper over bass drops",
        "I float in oversized coat",
        "I drag mascara waterfalls",
        "I belt a soft scream",
        "I walk through midnight neon",
        "I strut like bad guy",
        "I beckon ghosts to dance",
        "I pair green hair clips",
        "I haunt the velvet stage",
        "I snap fingers to silence",
        "I sway across the dark",
        "I promise to stay shady",
        "I nod to ocean eyes",
        "I mirror the hush tone",
        "I count the spotlight breaths",
        "I craft a pastel mood",
        "I layer quiet harmonies",
        "I lean into whisper vocals",
        "I underline the neon drips",
        "I pace the moody beat",
        "I wear a flannel shield",
        "I spin in velvet fog",
        "I float on adventurous bass",
        "I trap the crowd in hush",
        "I drop a wry grin",
        "I flip the bad guy nod",
        "I gesture to the silence",
        "I wave neon to camera",
        "I count the heartbeat drops",
        "I float in late-night hush",
        "I spark the fluorescent glow",
        "I hush the paparazzi flash",
        "I wring the whispered lines",
        "I craft a salty vibe",
        "I lace up the dark boots",
        "I claim my midnight throne",
        "I drift through pastel fog",
        "I dare the crowd to sway",
        "I spin the broken heart",
        "I filter my breathy lyric",
        "I tap the rhythmic pulse",
        "I clutch the avant pop pulse",
        "I keep the stage still",
        "I tune the bass to tremble",
        "I cue a drone of synth",
        "I flick the hair neon",
        "I coax the hush chorus",
        "I step around the spotlight",
        "I hail the hushed applause",
        "I promise midnight lullaby"
      ]
    }
  }
}
