{
  "$schema": "./schema.json",
  "name": "kr-infinite-challenge",
  "displayName": "Infinite Challenge",
  "category": "entertainment",
  "description": "Infinite Challenge variety show spinner verbs",
  "author": "JJ",
  "github": "doublej",
  "language": "ko_KR",
  "config": {
    "showTurnDuration": false,
    "spinnerVerbs": {
      "mode": "replace",
      "verbs": [
        "유재석처럼 진행하기",
        "박명수 흉내내기",
        "정준하 웃음벨 울리기",
        "하하 밝게 웃기",
        "정형돈처럼 춤추기",
        "노홍철 겁먹기",
        "보트 경주하기",
        "음악 페스티벌 열기",
        "격투기 도전하기",
        "릴레이 뛰기",
        "벌칙 받기",
        "미션 실패하기",
        "물에 빠지기",
        "도망치기",
        "트러블 일으키기",
        "혼자 남겨지기",
        "꾸짖음 당하기",
        "비명 지르기",
        "분노 폭발하기",
        "우는척하기",
        "거짓말 하기",
        "배신하기",
        "화해하기",
        "대사 외치기",
        "표정 짓기",
        "창피 당하기",
        "웃음 참기",
        "속상해 하기",
        "자존심 상하기",
        "긴장하기",
        "치킨 쏘기",
        "술 마시기",
        "노래 자랑하기",
        "나이 티내기",
        "약점 잡기",
        "계획 세우기",
        "함정 파기",
        "우승 차지하기",
        "최악의 팀이 되기",
        "동료 밀어내기",
        "환호 받기",
        "야유 받기",
        "놀라기",
        "혼란스러워 하기",
        "멘붕 오기",
        "회복하기",
        "웃음터지기",
        "추억 남기기",
        "전설 되기",
        "우정 다지기"
      ]
    }
  }
}
