{
  "$schema": "./schema.json",
  "name": "jp-gaki-no-tsukai",
  "displayName": "Gaki no Tsukai",
  "category": "entertainment",
  "description": "Gaki no Tsukai batsu game spinner verbs",
  "author": "JJ",
  "github": "doublej",
  "language": "ja_JP",
  "config": {
    "showTurnDuration": false,
    "spinnerVerbs": {
      "mode": "replace",
      "verbs": [
        "田中をビンタ",
        "松本つっこみ",
        "喉キック",
        "笑い我慢",
        "脇腹つつく",
        "豆投げ",
        "泣く真似",
        "逃げまわる",
        "懸賞金ゲット",
        "地獄部屋へ",
        "絶対笑うな",
        "マスク被る",
        "カツラかぶり",
        "変装する",
        "タイキック",
        "町田からかう",
        "ゲスト登場",
        "忍者現れ",
        "女性ゲスト",
        "サプライズ",
        "罰ゲーム",
        "絶叫する",
        "浜田がやる",
        "松本の顔",
        "遠藤虐め",
        "アウト",
        "バス停で待つ",
        "爆笑止まらず",
        "縛られる",
        "水びたし",
        "火が出る",
        "電気ショック",
        "気絶する",
        "泣き笑い",
        "大人しくなる",
        "震える",
        "目が潤む",
        "汗だくだく",
        "息できない",
        "腕広げる",
        "頭抱える",
        "目そらし",
        "立ち上がる",
        "駄目だ",
        "完璧",
        "セーフ",
        "チンチン",
        "長州小力",
        "ホセ登場",
        "バスツアー"
      ]
    }
  }
}
