{
  "$schema": "./schema.json",
  "name": "idiot",
  "displayName": "Idiot",
  "category": "original",
  "description": "Presidential idiot spinner verbs",
  "author": "Jurre-Jan Smit",
  "github": "doublej",
  "language": "en_GB",
  "config": {
    "showTurnDuration": false,
    "spinnerVerbs": {
      "mode": "replace",
      "verbs": [
        "I'm saying fake news",
        "I'm declaring a witch hunt",
        "I'm accusing everyone of rigging",
        "I'm demanding absolute loyalty",
        "I'm insisting I won bigly",
        "I'm bragging about Fifth Avenue",
        "I'm bragging about crowd size",
        "I'm claiming the best words",
        "I'm calling an opponent nasty",
        "I'm picking a mean nickname",
        "I'm renaming my critics losers",
        "I'm mocking a POW hero",
        "I'm bragging about grabbing women",
        "I'm calling it locker talk",
        "I'm suggesting injecting disinfectant",
        "I'm claiming I was sarcastic",
        "I'm saying very fine people",
        "I'm blaming both sides loudly",
        "I'm telling them stand back",
        "I'm telling them stand by",
        "I'm calling for a Muslim ban",
        "I'm smearing immigrants as criminals",
        "I'm demanding Mexico pay for wall",
        "I'm chanting build the wall",
        "I'm leading a lock her up chant",
        "I'm calling the press enemies",
        "I'm threatening to sue reporters",
        "I'm attacking a Gold Star family",
        "I'm asking Russia if listening",
        "I'm promising a perfect phone call",
        "I'm insisting it was perfect",
        "I'm denying saying what I said",
        "I'm doubling down without blinking",
        "I'm saying nobody knew",
        "I'm calling it a total hoax",
        "I'm demanding votes be found",
        "I'm pressuring officials to flip results",
        "I'm threatening to jail opponents",
        "I'm praising myself as genius",
        "I'm bragging about my IQ",
        "I'm claiming everyone loves me",
        "I'm saying I alone can fix it",
        "I'm praising strongmen as friends",
        "I'm demanding law and order",
        "I'm calling protesters thugs",
        "I'm interrupting the moderator",
        "I'm talking over every question",
        "I'm refusing to answer directly",
        "I'm rambling about ratings",
        "I'm complaining about Saturday Night Live"
      ]
    }
  }
}
