{
  "$schema": "./schema.json",
  "name": "br-chaves",
  "displayName": "Chaves",
  "category": "entertainment",
  "description": "Chaves vecindad comedy spinner verbs",
  "author": "JJ",
  "github": "doublej",
  "language": "pt_BR",
  "config": {
    "showTurnDuration": false,
    "spinnerVerbs": {
      "mode": "replace",
      "verbs": [
        "Pedir um sanduíche de presunto",
        "Levar um cascudo de Dona Florinda",
        "Correr da cobrança do aluguel",
        "Esconder-se no barril velho",
        "Chorar sem motivo aparente",
        "Fazer travessura na vecindad",
        "Dizer 'isso, isso, isso!'",
        "Apanhar de chinelo da mãe",
        "Pedir dinheiro a Seu Barriga",
        "Fingir pobreza para Seu Madruga",
        "Receber bofetada de mão aberta",
        "Comer presunto escondido",
        "Brincar de pega-pega com amigos",
        "Fugir dos problemas da vida",
        "Fazer algo sem querer querendo",
        "Gritar 'Quico!' em desespero",
        "Pedir ajuda a Dona Clotilde",
        "Aprender uma lição importante",
        "Limpar a rua da vila",
        "Tentar arrumar as roupas",
        "Procurar comida no lixo",
        "Bater na porta de Dona Florinda",
        "Cumprimentar o Professor Girafales",
        "Pedir proteção ao Seu Madruga",
        "Sofrer as consequências das travessuras",
        "Cair na lama durante brincadeira",
        "Emprestar algo sem devolver",
        "Receber um presente inesperado",
        "Dançar ao som da música",
        "Ter medo da bruxa do 71",
        "Pedir um favor a Quico",
        "Ofender o ego de Quico",
        "Buscar aventura na vecindad",
        "Fazer piada sobre os pais",
        "Comer bolo da festa",
        "Brincar de esconde-esconde",
        "Consertar algo quebrado",
        "Ajudar Seu Madruga a escapar",
        "Reclamar sobre a vida difícil",
        "Rir fazendo uma brincadeira",
        "Dormir no barril",
        "Procurar amor como Professor",
        "Sofrer rejeição amorosa",
        "Ficar com ciúmes do Quico",
        "Rogar pragas no inimigo",
        "Roubar o sanduíche do amigo",
        "Pedir perdão de joelhos",
        "Chorar pensando em Seu Madruga",
        "Comemorar uma pequena vitória",
        "Sonhar com um futuro melhor"
      ]
    }
  }
}
