{
  "$schema": "./schema.json",
  "name": "us-seinfeld",
  "displayName": "Seinfeld",
  "category": "entertainment",
  "description": "Seinfeld spinner verbs — a show about nothing, verbs about everything",
  "author": "Generated",
  "github": "doublej",
  "language": "en_US",
  "config": {
    "spinnerVerbs": {
      "mode": "replace",
      "verbs": [
        "Yada yada yada-ing the details",
        "Double-dipping the chip again",
        "Shrinking in the pool",
        "Becoming the master of my domain",
        "Getting the top of the muffin only",
        "Serenity now, insanity later",
        "Placing the call to the Moviefone guy",
        "Pretending to be an architect",
        "Reserving a car with no car to reserve",
        "Spongeworthy evaluation in progress",
        "Importing and exporting latex",
        "Looking for the car in the parking garage",
        "Checking if these are real or spectacular",
        "Festivus airing of grievances",
        "Attempting the feat of strength",
        "Getting the big salad sorted",
        "Putting it in the vault",
        "Taking it out of the vault actually",
        "Not that there's anything wrong with that",
        "Asking for the soup very carefully",
        "No soup for you, next",
        "Re-gifting the label maker",
        "Pretending to work at Vandelay Industries",
        "Close-talking uncomfortably close",
        "Low-talking inaudibly",
        "High-talking unexpectedly",
        "Dealing with a puffy shirt situation",
        "Jockeying for the good apartment",
        "Waiting impatiently at the Chinese restaurant",
        "Debating the merits of the pick",
        "Stealing the marble rye back",
        "Questioning if the dingo ate your baby",
        "Summoning a man-hands handshake",
        "Developing a Pez dispenser strategy",
        "Mulva? Dolores? Figuring it out",
        "Doing the opposite of every instinct",
        "Eating a candy bar with a knife and fork",
        "Checking the Bubble Boy's trivia answer",
        "Getting even with the Drake",
        "Being the bad breaker-upper",
        "Moving like a frightened turtle",
        "Faking it at the office convincingly",
        "Booking a non-existent vacation",
        "Staking out a parking space indefinitely",
        "Drafting a strongly worded letter",
        "Sidling up to the counter nonchalantly",
        "Ménage à trois-ing the roommate switch",
        "Stuffing the mailbox with Pottery Barn catalogues",
        "Dancing the Elaine dance badly",
        "These pretzels are making me thirsty"
      ]
    }
  }
}
