{
  "$schema": "./schema.json",
  "name": "au-kath-and-kim",
  "displayName": "Kath & Kim",
  "category": "entertainment",
  "description": "Kath & Kim suburban satire spinner verbs",
  "author": "JJ",
  "github": "doublej",
  "language": "en_AU",
  "config": {
    "showTurnDuration": false,
    "spinnerVerbs": {
      "mode": "replace",
      "verbs": [
        "I look at moi shamelessly",
        "I pronounce effluent as affluent",
        "I poruse the Fountain Gate shops",
        "I pacifically need that thing",
        "I marinate Kel's snags lovingly",
        "I parade my camisole proudly",
        "I say it's noice and different",
        "I straighten my seams constantly",
        "I shop at Fountain Gate",
        "I wear my holiday outfit",
        "I mention my good fortune",
        "I ask inappropriate health questions",
        "I recline upon my lounge",
        "I serve my meat devotedly",
        "I criticize with backhanded compliments",
        "I call everyone darl today",
        "I perfect my suburban accent",
        "I discuss my holiday endlessly",
        "I admire myself in mirrors",
        "I dye my hair recently",
        "I plan my next soir√©e",
        "I tell embarrassing stories loudly",
        "I correct everyone's pronunciation",
        "I avoid my responsibilities obviously",
        "I complain about trivial matters",
        "I wear my hat awkwardly",
        "I flirt with younger men",
        "I make devastating cruel observations",
        "I bore everyone with details",
        "I forget things very conveniently",
        "I mention my expensive purchases",
        "I shuffle around quite slowly",
        "I mumble about meat endlessly",
        "I stare blankly ahead quietly",
        "I fail to grasp subtlety",
        "I work in admissions somewhere",
        "I question whether that's normal",
        "I wear sensible shoes always",
        "I ignore obvious social cues",
        "I describe things incorrectly often",
        "I mispronounce basic words badly",
        "I speak about my diet",
        "I sit very still silently",
        "I wonder about things absurdly",
        "I practice my shocked expression",
        "I display my ignorance proudly",
        "I mention something slightly offensive",
        "I repeat myself unnecessarily often",
        "I nod along very politely",
        "I stand there looking blank"
      ]
    }
  }
}
