{
  "$schema": "./schema.json",
  "name": "us-star-wars",
  "displayName": "Star Wars",
  "category": "entertainment",
  "description": "Star Wars spinner verbs â€” a long time ago in a galaxy far, far away",
  "author": "Claude",
  "github": "anthropics",
  "language": "en_US",
  "config": {
    "spinnerVerbs": {
      "mode": "replace",
      "verbs": [
        "Using the Force aggressively",
        "Searching for the droids",
        "Making the Kessel Run faster",
        "Consulting the Jedi archives",
        "Powering up the hyperdrive",
        "Negotiating with a Hutt",
        "Dodging TIE fighter blasts",
        "Repairing the hyperdrive again",
        "Translating for Chewbacca",
        "Setting coordinates for Alderaan",
        "Assembling a new lightsaber",
        "Sensing a disturbance nearby",
        "Checking the high ground status",
        "Rerouting through the asteroid field",
        "Trusting my feelings on this",
        "Intercepting a holographic message",
        "Warming up the tractor beam",
        "Locking S-foils in attack position",
        "Calibrating the targeting computer",
        "Avoiding the dark side briefly",
        "Convincing the stormtroopers to move along",
        "Levitating an X-wing from the swamp",
        "Recalculating the trench run approach",
        "Parking the Millennium Falcon sideways",
        "Dispatching a probe droid quietly",
        "Practising Force lightning responsibly",
        "Deploying the shield generator",
        "Scanning for life forms below",
        "Escaping the trash compactor",
        "Decoding the Death Star plans",
        "Running from a rancor situation",
        "Questioning the senate's authority",
        "Spinning because it's a good trick",
        "Requesting docking clearance politely",
        "Powering the deflector shields",
        "Loading the proton torpedoes",
        "Summoning Yoda for advice",
        "Reviewing the bounty hunter list",
        "Crossing the Dune Sea carefully",
        "Silencing the thermal exhaust port",
        "Restraining a bad feeling about this",
        "Meditating before the final battle",
        "Boarding the Star Destroyer quietly",
        "Igniting all available lightsabers",
        "Plotting a course through hyperspace",
        "Outrunning an Imperial blockade",
        "Feeding the porgs reluctantly",
        "Scavenging parts from the wreckage",
        "Transmitting the rebel signal now",
        "Completing Jedi training at last"
      ]
    }
  }
}
