{
  "$schema": "./schema.json",
  "name": "es-camera-cafe",
  "displayName": "Cámera Café",
  "category": "entertainment",
  "description": "Camera Café office break-room spinner verbs",
  "author": "JJ",
  "github": "doublej",
  "language": "es_ES",
  "config": {
    "showTurnDuration": false,
    "spinnerVerbs": {
      "mode": "replace",
      "verbs": [
        "Esperar a que salga el café caliente",
        "Comentar los chismes de la oficina",
        "Evitar trabajo con conversación trivial",
        "Quejarse de los jefes desde lejos",
        "Pretender estar ocupado cuando llega alguien",
        "Contar historias sobre viajes imaginarios",
        "Filosofar sobre la vida entre tragos",
        "Ignorar llamadas de teléfono hasta después",
        "Competir por la mejor taza de café",
        "Criticar el comportamiento de nuevos empleados",
        "Flirtear descaradamente con compañero incómodo",
        "Limpiar misteriosamente la máquina sin motivo",
        "Robar bolsitas de café para casa",
        "Bromear sobre el dinero del fondo común",
        "Interrumpir las conversaciones ajenas sin permiso",
        "Analizar minucias como si fueran importantes",
        "Revelar secretos que no debería revelar",
        "Dramatizar problemas personales insignificantes",
        "Protestar porque falta leche en la nevera",
        "Pelear por la última galleta de la bandeja",
        "Observar a los compañeros desde el pasillo",
        "Fingir entender chistes que no comprendo",
        "Mencionar constantemente las vacaciones que tengo",
        "Criticar el uniforme de la recepcionista",
        "Bailar mientras espero que salga el café",
        "Imitar la voz del jefe cuando sale",
        "Planejar actividades después sin invitar a todos",
        "Quitar el café ajeno de manera descarada",
        "Conjeturar sobre los salarios de compañeros",
        "Exagerar los problemas de la máquina de café",
        "Murmurar críticas a espaldas de otros",
        "Organizar rifas de dinero para causas dudosas",
        "Presumir de la relación con alguien importante",
        "Burlar la seguridad con puertas de servicio",
        "Inventar excusas para no ir a reuniones",
        "Desmenuzar los defectos de cada empleado",
        "Fingir estar buscando algo de gran importancia",
        "Pedir prestado dinero que nunca devuelves",
        "Lamer la cuchara de café en silencio incómodo",
        "Cantar canciones malas mientras nadie te ve",
        "Competir por contar el chisme más jugoso",
        "Simular que comprendo el correo corporativo",
        "Recordar anécdotas del primer día de trabajo",
        "Criticar sin parar el servicio de catering",
        "Vigilar quién se toma el mejor café",
        "Hacer comentarios sobre el físico de otros",
        "Mentir sobre el motivo de tu ausencia",
        "Organizar alianzas secretas contra compañeros incómodos",
        "Rondar la máquina esperando que tenga compañía",
        "Contar minutos hasta que termine la pausa"
      ]
    }
  }
}
