{
  "$schema": "./schema.json",
  "name": "fr-kaamelott",
  "displayName": "Kaamelott",
  "category": "entertainment",
  "description": "Kaamelott Arthurian comedy spinner verbs",
  "author": "JJ",
  "github": "doublej",
  "language": "fr_FR",
  "config": {
    "showTurnDuration": false,
    "spinnerVerbs": {
      "mode": "replace",
      "verbs": [
        "Convoquer la Table Ronde inutilement",
        "Chercher le Graal en vain",
        "Écouter les bêtises de Perceval",
        "Supporter les colères de Léodagan",
        "Expliquer la politique à un idiot",
        "Consulter Merlin pour rien",
        "Organiser une réunion sans décision",
        "Affronter les chevaliers romains",
        "Questionner sa légitimité royale",
        "Placer Lancelot à la Table Ronde",
        "Protéger Guenièvre discrètement",
        "Demander du vin à Léodagan",
        "Endurer les critiques de Dame Séli",
        "Chercher une solution politique",
        "Diriger les chevaliers britanniques",
        "Affronter les Saxons du nord",
        "Résoudre les conflits de succession",
        "Écouter des conseils ridicules",
        "Refuser les ordres du roi",
        "Accepter que c'est pas faux",
        "Discuter de la Burgonde",
        "Planifier une quête mythique",
        "Négocier avec Rome",
        "Survivre aux réunions du château",
        "Inviter Bohort à l'aventure",
        "Supporter Karadoc et Perceval",
        "Juger les compétences chevaleresques",
        "Maintenir une paix difficile",
        "Regretter ses décisions passées",
        "Étudier la magie avec Merlin",
        "Expliquer Arthur aux autres rois",
        "Lutter contre les forces sombres",
        "Tenir un discours sans autorité",
        "Accepter l'avis de Léodagan",
        "Chercher de la sagesse perdue",
        "Douter de sa légitimité constamment",
        "Écouter les histoires inutiles",
        "Défendre le trône britannique",
        "Partager le repas à la Table",
        "Réfléchir sur le sens de tout",
        "Demander conseil à ses chevaliers",
        "Affronter ses doutes quotidiens",
        "Expliquer pourquoi c'est pas faux",
        "Survivre aux pitreries du château",
        "Ignorer les conseils de Merlin",
        "Entraîner les futurs chevaliers",
        "Supporter les jalousies entre pairs",
        "Chercher la validation des autres",
        "Organiser le chaos bureaucratique",
        "Accepter le destin absurde"
      ]
    }
  }
}
