{
  "$schema": "./schema.json",
  "name": "de-dinner-for-one",
  "displayName": "Dinner for One",
  "category": "entertainment",
  "description": "Dinner for One New Year's Eve sketch spinner verbs",
  "author": "JJ",
  "github": "doublej",
  "language": "de_DE",
  "config": {
    "showTurnDuration": false,
    "spinnerVerbs": {
      "mode": "replace",
      "verbs": [
        "Den Tiger überspringen mit Eleganz",
        "Miss Sophies Glas füllen vorsichtig",
        "Die Stimmen der Gäste wechseln",
        "Mit Sir Toby Sherry trinken",
        "Den Admiral von Schneider begrüßen",
        "Mr. Pommeroy höflich begrüßen",
        "Mr. Winterbottom willkommen heißen",
        "Das Champagner öffnen feierlich",
        "Über den Teppich stolpern",
        "Die Suppe elegant servieren",
        "Den Fisch meisterlich präsentieren",
        "Das Roastbeef schneiden sorgfältig",
        "Die Soße schütten ungeschickt",
        "Das Glas leeren nach oben",
        "Der Musik lauschen wehmütig",
        "Die Todesanzeige lesen feierlich",
        "Sich vor Miss Sophie verneigen",
        "Einen Drink heimlich nachschenken",
        "Immer betrunkener werden langsam",
        "Augen zum Publikum verdrehen",
        "Den Walzer tanzend genießen",
        "Von Sir Toby erzählen stolz",
        "Das gleiche Prozedere wiederholen wieder",
        "Nach jedem Gast die Haltung wechseln",
        "Den Teppich erneut überspringen müssen",
        "Mit verschiedenen Accenten sprechen",
        "Die Serviette elegant über Schulter",
        "Einen feierlichen Toast halten",
        "Den melancholischen Moment genießen",
        "Das Besteck neu arrangieren eifrig",
        "Die Gläser zusammenstoßen laut",
        "Sich nervös auf die Lippen lecken",
        "Das Champagner kritisch probieren",
        "Die Vergangenheit Revue passieren lassen",
        "Sich für den nächsten Gang hinsetzen",
        "Die Musik lauter drehen immer",
        "Noch einen Drink schnell nehmen",
        "Den Tisch perfekt decken",
        "Den Kaffee zum Abschluss servieren",
        "Eine Zigarre großzügig anbieten",
        "Mit allen Gästen lustig sprechen",
        "Das Ritual Jahr für Jahr zeigen",
        "Miss Sophie die Hand reichen galant",
        "Die Stimmen perfekt wechseln",
        "Den Teppich erfolgreich überspringen",
        "Leise zu singen beginnen",
        "Den Dinner-Gang elegant durchführen",
        "Den Abend bewundernd genießen",
        "Sich müde vom Tisch erheben",
        "Den nächsten Jahrestag herbei wünschen"
      ]
    }
  }
}
